{
  "candidate_records": [],
  "completeness_claim": false,
  "counts": {
    "candidates": 0,
    "frozen_tests": 0,
    "gaps": 12,
    "revisions": 0,
    "world_receipts": 0
  },
  "frozen_test_records": [],
  "gaps": [
    {
      "accepted_domain_recovery": "Recover the native domain baseline and show that each candidate preserves its declared order and boundary behavior before outcome contact.",
      "candidate_ids": [],
      "execution_requirement": "scale-contract-required",
      "gap_id": "frontier-gap:GP-03",
      "held_out_incremental_prediction": "Only after the scale contract survives, compare held-out calibration and prediction; otherwise publish non-identifiability.",
      "independent_replication": "An external custodian audits the scale contract, reruns any lawful frozen comparison, and publishes nulls.",
      "kill_criterion": "No conclusion survives admissible reparameterization, rank reversals are arbitrary, or the measures encode the desired result.",
      "maturity_state": "packet-complete",
      "native_equations": "The selected minimum convention and other conjunctive rules; a product is admissible as a ranking only under separately defended cardinal scales.",
      "native_objects": "Ordinal foresight and usable-means ranks, declared admissible transformations, and outcome; cardinal variables only if separately validated and commensurate.",
      "no_placement_rival": "No cross-factor scalar ranking, or an ordinary domain aggregator selected without D-level placement.",
      "permutation_challenge": "Reparameterize inputs over the declared admissible class and test whether the conclusion and ranking survive.",
      "public_href": "/frontier/v1/gaps/GP-03.json",
      "public_routing_state": {
        "execution": "discriminator-or-nonidentifiability-required",
        "maturity": "packet-complete",
        "program": "deferred"
      },
      "question": "Does any cross-factor AND-class conclusion survive the admissible strictly increasing reparameterizations of the declared ordinal inputs?",
      "receipt_ids": [],
      "revision_ids": [],
      "schema_id": "FrontierGap.v1",
      "source_gap_id": "GP-03",
      "source_refs": [
        {
          "authority": "canonical_gap_owner",
          "json_pointer": "/rows/0",
          "path": "03_METHODOLOGY/00_W7_SCIENCE_INTEGRATION_EXECUTION_REGISTER.yaml",
          "sha256": "sha256:775800070a05ca119a52874e34c86cfb3515ae5c55d1292c06e9115d369f843f"
        },
        {
          "authority": "public_routing_overlay",
          "json_pointer": "/openQuestions/2",
          "path": "12_PUBLIC_SITE/living-map.json",
          "sha256": "sha256:89361e816e74ae838e00013d70ebeddfa4bf9741a7db5e4ce986aa64b4ba9e16"
        }
      ],
      "survivor": "Joint necessity and the selected minimum convention; a local product only under a defended cardinal scale.",
      "test_ids": [],
      "tier": "[C]",
      "title": "Ordinal AND-class aggregation"
    },
    {
      "accepted_domain_recovery": "Recover resource accounting and task-performance baselines.",
      "candidate_ids": [],
      "execution_requirement": "ready-to-freeze",
      "gap_id": "frontier-gap:GP-04",
      "held_out_incremental_prediction": "Predict outcome and remaining means in held-out states.",
      "independent_replication": "Independent lab repeats the measurement design.",
      "kill_criterion": "No recurrent trade-off or a simpler surface predicts as well.",
      "maturity_state": "packet-complete",
      "native_equations": "No-tradeoff, additive, nonlinear and state-dependent resource-surface rivals.",
      "native_objects": "Measured modeling cost, usable means, task state and outcome.",
      "no_placement_rival": "Ordinary resource-allocation model without Phi/V interpretation.",
      "permutation_challenge": "Exchange labels and functional forms while holding measured budgets fixed.",
      "public_href": "/frontier/v1/gaps/GP-04.json",
      "public_routing_state": {
        "execution": "ready-to-freeze",
        "maturity": "packet-complete",
        "program": "queued"
      },
      "question": "What measurable budget surface, if any, relates option-model quality, its resource cost, and remaining usable means?",
      "receipt_ids": [],
      "revision_ids": [],
      "schema_id": "FrontierGap.v1",
      "source_gap_id": "GP-04",
      "source_refs": [
        {
          "authority": "canonical_gap_owner",
          "json_pointer": "/rows/1",
          "path": "03_METHODOLOGY/00_W7_SCIENCE_INTEGRATION_EXECUTION_REGISTER.yaml",
          "sha256": "sha256:775800070a05ca119a52874e34c86cfb3515ae5c55d1292c06e9115d369f843f"
        },
        {
          "authority": "public_routing_overlay",
          "json_pointer": "/openQuestions/3",
          "path": "12_PUBLIC_SITE/living-map.json",
          "sha256": "sha256:89361e816e74ae838e00013d70ebeddfa4bf9741a7db5e4ce986aa64b4ba9e16"
        }
      ],
      "survivor": "Joint necessity may remain a task-specific description.",
      "test_ids": [],
      "tier": "[C]",
      "title": "Foresight and usable-means surface"
    },
    {
      "accepted_domain_recovery": "Reproduce known control effects without an Emergentist variable.",
      "candidate_ids": [],
      "execution_requirement": "new-preregistration-required",
      "gap_id": "frontier-gap:GP-07",
      "held_out_incremental_prediction": "Content-specific change in present action beyond matched controls.",
      "independent_replication": "Independent sample and analysts reproduce the effect.",
      "kill_criterion": "Effect vanishes under fair controls or does not replicate.",
      "maturity_state": "component-supported",
      "native_equations": "Native behavioral or cognitive model selected before data contact.",
      "native_objects": "Present representations, salience, demand, reward, memory, expectancy and action.",
      "no_placement_rival": "Generic framing, salience, demand, memory or reward model.",
      "permutation_challenge": "Permute content while matching salience, demand and reward.",
      "public_href": "/frontier/v1/gaps/GP-07.json",
      "public_routing_state": {
        "execution": "new-preregistration-required",
        "maturity": "component-supported",
        "program": "queued"
      },
      "question": "Does changing represented future content alter present selection beyond salience, demand, reward framing, memory, and expectancy?",
      "receipt_ids": [],
      "revision_ids": [],
      "schema_id": "FrontierGap.v1",
      "source_gap_id": "GP-07",
      "source_refs": [
        {
          "authority": "canonical_gap_owner",
          "json_pointer": "/rows/2",
          "path": "03_METHODOLOGY/00_W7_SCIENCE_INTEGRATION_EXECUTION_REGISTER.yaml",
          "sha256": "sha256:775800070a05ca119a52874e34c86cfb3515ae5c55d1292c06e9115d369f843f"
        },
        {
          "authority": "public_routing_overlay",
          "json_pointer": "/openQuestions/7",
          "path": "12_PUBLIC_SITE/living-map.json",
          "sha256": "sha256:89361e816e74ae838e00013d70ebeddfa4bf9741a7db5e4ce986aa64b4ba9e16"
        }
      ],
      "survivor": "Present models can guide ordinary present action.",
      "test_ids": [],
      "tier": "[I/C]",
      "title": "Controlled future-content effect"
    },
    {
      "accepted_domain_recovery": "Both models recover training-domain behavior before intervention.",
      "candidate_ids": [],
      "execution_requirement": "real-domain-freeze-required",
      "gap_id": "frontier-gap:GP-01",
      "held_out_incremental_prediction": "Relation-aware model predicts held-out intervention outcome.",
      "independent_replication": "Independent domain team repeats the intervention.",
      "kill_criterion": "Relations add no discrimination or fail to recover element behavior.",
      "maturity_state": "packet-complete",
      "native_equations": "Element-only and relation-aware native models.",
      "native_objects": "Identical element inventories, intervenable relation structures and outcomes.",
      "no_placement_rival": "Feature engineering or definitional expansion without emergence language.",
      "permutation_challenge": "Randomize relation labels and structures while preserving inventories.",
      "public_href": "/frontier/v1/gaps/GP-01.json",
      "public_routing_state": {
        "execution": "real-domain-freeze-required",
        "maturity": "packet-complete",
        "program": "queued"
      },
      "question": "Can a relation-aware model predict an intervention better than a model with the same elements but no explicit relation structure?",
      "receipt_ids": [],
      "revision_ids": [],
      "schema_id": "FrontierGap.v1",
      "source_gap_id": "GP-01",
      "source_refs": [
        {
          "authority": "canonical_gap_owner",
          "json_pointer": "/rows/3",
          "path": "03_METHODOLOGY/00_W7_SCIENCE_INTEGRATION_EXECUTION_REGISTER.yaml",
          "sha256": "sha256:775800070a05ca119a52874e34c86cfb3515ae5c55d1292c06e9115d369f843f"
        },
        {
          "authority": "public_routing_overlay",
          "json_pointer": "/openQuestions/0",
          "path": "12_PUBLIC_SITE/living-map.json",
          "sha256": "sha256:89361e816e74ae838e00013d70ebeddfa4bf9741a7db5e4ce986aa64b4ba9e16"
        }
      ],
      "survivor": "D2 remains a useful configuration address.",
      "test_ids": [],
      "tier": "[C]",
      "title": "Relation intervention"
    },
    {
      "accepted_domain_recovery": "Recover carrier, incentive, command and environment effects first.",
      "candidate_ids": [],
      "execution_requirement": "composite-test-required",
      "gap_id": "frontier-gap:GP-06",
      "held_out_incremental_prediction": "Trace intervention predicts later selection across turnover beyond rivals.",
      "independent_replication": "A second site reproduces all five markers with bearer costs.",